[
  {
    "record_type": "application_decision_record",
    "decision_id": "dec-0001",
    "application_date": "2026-05-03",
    "segment": "micro",
    "decision_outcome": "approved",
    "manual_review_flag": false,
    "override_flag": false,
    "underwriting": {
      "score": 712.4,
      "requested_amount": 45000.0,
      "decision_timestamp": "2026-05-03T14:22:00Z"
    },
    "monitoring": {
      "region": "south",
      "channel": "digital",
      "review_batch_id": "run-2026-05"
    }
  },
  {
    "record_type": "application_decision_record",
    "decision_id": "dec-0002",
    "application_date": "2026-05-04",
    "segment": "small",
    "decision_outcome": "declined",
    "manual_review_flag": true,
    "override_flag": true,
    "underwriting": {
      "score": 601.8,
      "requested_amount": 90000.0,
      "decision_timestamp": "2026-05-04T09:10:00Z"
    },
    "monitoring": {
      "region": "midwest",
      "channel": "branch",
      "review_batch_id": "run-2026-05"
    }
  }
]
